{
  "classKey": "CARRIER",
  "name": "Carrier",
  "position": {
    "x": 0,
    "y": 0
  },
  "heading": 1,
  "speed": 0,
  "status": 2,
  "damage": {
    "total": 24,
    "hits": 19,
    "tracks": [
      [
        0,
        0,
        0,
        0,
        0,
        0
      ],
      [
        0,
        0,
        0,
        0,
        0,
        0
      ],
      [
        0,
        0,
        0,
        0,
        0,
        0
      ],
      [
        0,
        1,
        1,
        1,
        1,
        1
      ]
    ]
  },
  "drive": {
    "thrust": 1,
    "status": 2
  },
  "firecons": [
    {
      "status": 0
    },
    {
      "status": 1
    },
    {
      "status": 1
    }
  ],
  "weapons": [
    {
      "type": "BEAM",
      "class": "B",
      "arcs": [
        "F",
        "P",
        "S"
      ],
      "status": 1
    },
    {
      "type": "BEAM",
      "class": "B",
      "arcs": [
        "F",
        "P",
        "S"
      ],
      "status": 1
    },
    {
      "type": "BEAM",
      "class": "B",
      "arcs": [
        "P",
        "A"
      ],
      "status": 1
    },
    {
      "type": "BEAM",
      "class": "B",
      "arcs": [
        "S",
        "A"
      ],
      "status": 0
    }
  ],
  "fighters": [
    {
      "count": 6,
      "status": 1
    },
    {
      "count": 6,
      "status": 1
    },
    {
      "count": 6,
      "status": 0
    }
  ]
}
